<?xml version="1.0" encoding="UTF-8"?>
<!-- Edited with XRT Chief Observer Tool version 2.0x40 (2080) -->
<!DOCTYPE PARM SYSTEM "XRTPAR.dtd">
<PARM>
  <modified author="KOBELSKI, Adam" dateTime="2012-05-30T02:50:01Z" />
  <name>G-Band - 2x2 - 24ms</name>
  <COT_info deleted="FALSE" lastUsed="2012-05-31T02:11:39Z" version="388C" locked="FALSE"
    tag="D8884F34CA83/388C" COTversion="2.0x40" COTbuild="2080" Mutable="TRUE" />
  <COT_slot>-1</COT_slot>
  <FltA_L1>0</FltA_L1>
  <FltB_L1>3</FltB_L1>
  <FltA_L2>0</FltA_L2>
  <FltB_L2>3</FltB_L2>
  <AspectShutter>1</AspectShutter>
  <ShutterMode>0</ShutterMode>
  <ImageType>0</ImageType>
  <Exposure>8</Exposure>
  <Calibration>0</Calibration>
  <Resolution>1</Resolution>
</PARM>
