<?xml version="1.0" encoding="UTF-8"?>
<!-- Edited with XRT Chief Observer Tool version 2.0x40 (2080) -->
<!DOCTYPE PARM SYSTEM "XRTPAR.dtd">
<PARM>
  <modified author="REEVES, Kathy" dateTime="2008-05-07T20:16:57Z" />
  <name>C/poly - 8192 ms - 1x1</name>
  <COT_info deleted="FALSE" lastUsed="2012-03-16T20:07:08Z" version="3752" locked="FALSE"
    tag="2B9D2492047D/3752" COTversion="2.0x40" COTbuild="2080" Mutable="TRUE" />
  <COT_slot>-1</COT_slot>
  <FltA_L1>2</FltA_L1>
  <FltB_L1>0</FltB_L1>
  <FltA_L2>2</FltA_L2>
  <FltB_L2>0</FltB_L2>
  <AspectShutter>0</AspectShutter>
  <ShutterMode>0</ShutterMode>
  <ImageType>0</ImageType>
  <Exposure>25</Exposure>
  <Calibration>0</Calibration>
  <Resolution>0</Resolution>
</PARM>
