<?xml version="1.0" encoding="UTF-8"?>
<!-- Edited with XRT Chief Observer Tool version 2.0x40 (2080) -->
<!DOCTYPE PARM SYSTEM "XRTPAR.dtd">
<PARM>
  <modified author="SHIMOJO, Masumi" dateTime="2008-02-28T03:34:43Z" />
  <name>Med-Be-8x8-23142ms</name>
  <COT_info deleted="FALSE" lastUsed="2007-07-10T08:41:11Z" version="3693" locked="FALSE"
    tag="C0043091D1D7/3693" COTversion="2.0x40" COTbuild="2080" Mutable="TRUE" />
  <COT_slot>-1</COT_slot>
  <FltA_L1>4</FltA_L1>
  <FltB_L1>0</FltB_L1>
  <FltA_L2>0</FltA_L2>
  <FltB_L2>0</FltB_L2>
  <AspectShutter>0</AspectShutter>
  <ShutterMode>0</ShutterMode>
  <ImageType>0</ImageType>
  <Exposure>28</Exposure>
  <Calibration>0</Calibration>
  <Resolution>3</Resolution>
</PARM>
