<?xml version="1.0" encoding="UTF-8"?>
<!-- Edited with XRT Chief Observer Tool version 2.0x40 (2080) -->
<!DOCTYPE PARM SYSTEM "XRTPAR.dtd">
<PARM>
  <modified author="ISHIBASHI, Bish" dateTime="2012-10-29T09:16:19Z" />
  <name>Al/poly (Thin-Be) - 4x4 - 16ms</name>
  <COT_info deleted="FALSE" lastUsed="2016-02-19T06:01:42Z" version="38BE" locked="FALSE"
    tag="879E38565EB7/38BE" COTversion="2.0x40" COTbuild="2080" Mutable="TRUE" />
  <COT_slot>-1</COT_slot>
  <FltA_L1>1</FltA_L1>
  <FltB_L1>0</FltB_L1>
  <FltA_L2>3</FltA_L2>
  <FltB_L2>0</FltB_L2>
  <AspectShutter>0</AspectShutter>
  <ShutterMode>0</ShutterMode>
  <ImageType>0</ImageType>
  <Exposure>7</Exposure>
  <Calibration>0</Calibration>
  <Resolution>2</Resolution>
</PARM>
