<?xml version="1.0" encoding="UTF-8"?>
<!-- Edited with XRT Chief Observer Tool version 2.0x40 (2080) -->
<!DOCTYPE PARM SYSTEM "XRTPAR.dtd">
<PARM>
  <modified author="YAJI, Kentaro" dateTime="2010-01-22T09:48:15Z" />
  <name>Ti/Poly - 4x4 - 16384ms</name>
  <COT_info deleted="FALSE" lastUsed="2010-02-05T09:47:21Z" version="3839" locked="FALSE"
    tag="2CA649EF2EA0/3839" COTversion="2.0x40" COTbuild="2080" Mutable="TRUE" />
  <COT_slot>-1</COT_slot>
  <FltA_L1>0</FltA_L1>
  <FltB_L1>2</FltB_L1>
  <FltA_L2>0</FltA_L2>
  <FltB_L2>2</FltB_L2>
  <AspectShutter>0</AspectShutter>
  <ShutterMode>0</ShutterMode>
  <ImageType>0</ImageType>
  <Exposure>27</Exposure>
  <Calibration>0</Calibration>
  <Resolution>2</Resolution>
</PARM>
