<?xml version="1.0" encoding="UTF-8"?>
<!-- Edited with XRT Chief Observer Tool version 2.0x40 (2080) -->
<!DOCTYPE PARM SYSTEM "XRTPAR.dtd">
<PARM>
  <modified author="SHIMOJO, Masumi" dateTime="2008-02-28T03:34:43Z" />
  <name>Med-Be (Med-Be) - 1x1 - 46284ms - Dark - Cal</name>
  <COT_info deleted="FALSE" lastUsed="2006-12-10T09:22:23Z" version="35CA" locked="FALSE"
    tag="0000005DF2D6/35CA" COTversion="2.0x40" COTbuild="2080" Mutable="TRUE" />
  <COT_slot>-1</COT_slot>
  <FltA_L1>4</FltA_L1>
  <FltB_L1>0</FltB_L1>
  <FltA_L2>4</FltA_L2>
  <FltB_L2>0</FltB_L2>
  <AspectShutter>0</AspectShutter>
  <ShutterMode>0</ShutterMode>
  <ImageType>1</ImageType>
  <Exposure>30</Exposure>
  <Calibration>1</Calibration>
  <Resolution>0</Resolution>
</PARM>
