<?xml version="1.0" encoding="UTF-8"?>
<!-- Edited with XRT Chief Observer Tool version 2.0x40 (2080) -->
<!DOCTYPE PARM SYSTEM "XRTPAR.dtd">
<PARM>
  <modified author="MINOSHIMA, Takashi" dateTime="2008-07-02T10:36:54Z" />
  <name>Thick-Be - 8x8 - 32768ms</name>
  <COT_info deleted="FALSE" lastUsed="2020-09-16T20:17:17Z" version="377A" locked="FALSE"
    tag="9E857F01D807/377A" COTversion="2.0x40" COTbuild="2080" Mutable="TRUE" />
  <COT_slot>-1</COT_slot>
  <FltA_L1>0</FltA_L1>
  <FltB_L1>5</FltB_L1>
  <FltA_L2>0</FltA_L2>
  <FltB_L2>5</FltB_L2>
  <AspectShutter>0</AspectShutter>
  <ShutterMode>0</ShutterMode>
  <ImageType>0</ImageType>
  <Exposure>29</Exposure>
  <Calibration>0</Calibration>
  <Resolution>3</Resolution>
</PARM>
