<?xml version="1.0" encoding="UTF-8"?>
<!-- Edited with XRT Chief Observer Tool version 2.0x40 (2080) -->
<!DOCTYPE PARM SYSTEM "XRTPAR.dtd">
<PARM>
  <modified author="SHIMOJO, Masumi" dateTime="2008-02-28T03:34:43Z" />
  <name>Thick-Be  - 1x1 - 46284 ms</name>
  <COT_info deleted="FALSE" lastUsed="2010-06-28T20:08:54Z" version="364C" locked="FALSE"
    tag="482003CFFBF1/364C" COTversion="2.0x40" COTbuild="2080" Mutable="TRUE" />
  <COT_slot>-1</COT_slot>
  <FltA_L1>0</FltA_L1>
  <FltB_L1>5</FltB_L1>
  <FltA_L2>0</FltA_L2>
  <FltB_L2>5</FltB_L2>
  <AspectShutter>0</AspectShutter>
  <ShutterMode>0</ShutterMode>
  <ImageType>0</ImageType>
  <Exposure>30</Exposure>
  <Calibration>0</Calibration>
  <Resolution>0</Resolution>
</PARM>
