<?xml version="1.0" encoding="UTF-8"?>
<!-- Edited with XRT Chief Observer Tool version 2.0x40 (2080) -->
<!DOCTYPE PARM SYSTEM "XRTPAR.dtd">
<PARM>
  <modified author="ISHIBASHI, Bish" dateTime="2008-12-23T23:11:55Z" />
  <name>C/Poly (Med-Be) - 4x4 - 1024ms</name>
  <COT_info deleted="FALSE" lastUsed="2013-12-06T18:17:17Z" version="37B3" locked="FALSE"
    tag="B65507A4B613/37B3" COTversion="2.0x40" COTbuild="2080" Mutable="TRUE" />
  <COT_slot>-1</COT_slot>
  <FltA_L1>2</FltA_L1>
  <FltB_L1>0</FltB_L1>
  <FltA_L2>4</FltA_L2>
  <FltB_L2>0</FltB_L2>
  <AspectShutter>0</AspectShutter>
  <ShutterMode>0</ShutterMode>
  <ImageType>0</ImageType>
  <Exposure>19</Exposure>
  <Calibration>0</Calibration>
  <Resolution>2</Resolution>
</PARM>
