<?xml version="1.0" encoding="UTF-8"?>
<!-- Edited with XRT Chief Observer Tool version 2.0x40 (2080) -->
<!DOCTYPE PARM SYSTEM "XRTPAR.dtd">
<PARM>
  <modified author="SHIMOJO, Masumi" dateTime="2008-02-28T03:34:43Z" />
  <name>Al/poly - 8x8 - 1ms - Dark - Obs</name>
  <COT_info deleted="FALSE" lastUsed="2006-11-18T08:27:08Z" version="356B" locked="FALSE"
    tag="000044654B16/356B" COTversion="2.0x40" COTbuild="2080" Mutable="TRUE" />
  <COT_slot>-1</COT_slot>
  <FltA_L1>1</FltA_L1>
  <FltB_L1>0</FltB_L1>
  <FltA_L2>1</FltA_L2>
  <FltB_L2>0</FltB_L2>
  <AspectShutter>0</AspectShutter>
  <ShutterMode>0</ShutterMode>
  <ImageType>1</ImageType>
  <Exposure>0</Exposure>
  <Calibration>0</Calibration>
  <Resolution>3</Resolution>
</PARM>
