<?xml version="1.0" encoding="UTF-8"?>
<!-- Edited with XRT Chief Observer Tool version 2.0x40 (2080) -->
<!DOCTYPE PARM SYSTEM "XRTPAR.dtd">
<PARM>
  <modified author="SHIMOJO, Masumi" dateTime="2008-02-28T03:34:43Z" />
  <name>Al/poly (C/Poly) - 1x1 - 16384ms</name>
  <COT_info deleted="FALSE" lastUsed="2008-04-29T02:34:23Z" version="352C" locked="FALSE"
    tag="00003AEC398C/352C" COTversion="2.0x40" COTbuild="2080" Mutable="TRUE" />
  <COT_slot>-1</COT_slot>
  <FltA_L1>1</FltA_L1>
  <FltB_L1>0</FltB_L1>
  <FltA_L2>2</FltA_L2>
  <FltB_L2>0</FltB_L2>
  <AspectShutter>0</AspectShutter>
  <ShutterMode>0</ShutterMode>
  <ImageType>0</ImageType>
  <Exposure>27</Exposure>
  <Calibration>0</Calibration>
  <Resolution>0</Resolution>
</PARM>
