<?xml version="1.0" encoding="UTF-8"?>
<!-- Edited with XRT Chief Observer Tool version 2.0x40 (2080) -->
<!DOCTYPE PARM SYSTEM "XRTPAR.dtd">
<PARM>
  <modified author="KOBELSKI, Adam" dateTime="2013-08-21T04:05:06Z" />
  <name>Thin-Be - 1x1 - 2897ms</name>
  <COT_info deleted="FALSE" lastUsed="2019-10-21T20:15:33Z" version="38CF" locked="FALSE"
    tag="36D50B7FFFA6/38CF" COTversion="2.0x40" COTbuild="2080" Mutable="TRUE" />
  <COT_slot>-1</COT_slot>
  <FltA_L1>3</FltA_L1>
  <FltB_L1>0</FltB_L1>
  <FltA_L2>3</FltA_L2>
  <FltB_L2>0</FltB_L2>
  <AspectShutter>0</AspectShutter>
  <ShutterMode>0</ShutterMode>
  <ImageType>0</ImageType>
  <Exposure>22</Exposure>
  <Calibration>0</Calibration>
  <Resolution>0</Resolution>
</PARM>
