<?xml version="1.0" encoding="UTF-8"?>
<!-- Edited with XRT Chief Observer Tool version 2.0x40 (2080) -->
<!DOCTYPE PARM SYSTEM "XRTPAR.dtd">
<PARM>
  <modified author="KANO, Ryouhei" dateTime="2009-01-16T05:21:16Z" />
  <name>Ti/Poly (Thick-Al) - 4x4 - 512ms</name>
  <COT_info deleted="FALSE" lastUsed="2012-03-03T03:19:54Z" version="3678" locked="FALSE"
    tag="D6AC1C38A971/3678" COTversion="2.0x40" COTbuild="2080" Mutable="TRUE" />
  <COT_slot>-1</COT_slot>
  <FltA_L1>0</FltA_L1>
  <FltB_L1>2</FltB_L1>
  <FltA_L2>0</FltA_L2>
  <FltB_L2>4</FltB_L2>
  <AspectShutter>0</AspectShutter>
  <ShutterMode>0</ShutterMode>
  <ImageType>0</ImageType>
  <Exposure>17</Exposure>
  <Calibration>0</Calibration>
  <Resolution>2</Resolution>
</PARM>
