<?xml version="1.0" encoding="UTF-8"?>
<!-- Edited with XRT Chief Observer Tool version 2.0x40 (2080) -->
<!DOCTYPE PARM SYSTEM "XRTPAR.dtd">
<PARM>
  <modified author="SAVCHEVA, Antonia" dateTime="2008-09-01T00:32:42Z" />
  <name>Al/mesh - 1x1 - 32768ms</name>
  <COT_info deleted="FALSE" lastUsed="2008-09-12T04:08:46Z" version="378F" locked="FALSE"
    tag="46C21E4DC19B/378F" COTversion="2.0x40" COTbuild="2080" Mutable="TRUE" />
  <COT_slot>-1</COT_slot>
  <FltA_L1>0</FltA_L1>
  <FltB_L1>1</FltB_L1>
  <FltA_L2>0</FltA_L2>
  <FltB_L2>1</FltB_L2>
  <AspectShutter>0</AspectShutter>
  <ShutterMode>0</ShutterMode>
  <ImageType>0</ImageType>
  <Exposure>29</Exposure>
  <Calibration>0</Calibration>
  <Resolution>0</Resolution>
</PARM>
