<?xml version="1.0" encoding="UTF-8"?>
<!-- Edited with XRT Chief Observer Tool version 2.0x39 (2080) -->
<!DOCTYPE PARM SYSTEM "XRTPAR.dtd">
<PARM>
  <modified author="MASUDA, Satoshi" dateTime="2009-12-16T02:57:40Z" />
  <name>Med-Al (Med-Al + Thick-Al) - 2x2 - 2048ms</name>
  <COT_info deleted="FALSE" lastUsed="2022-11-09T02:21:46Z" version="3827" locked="FALSE"
    tag="ADFC118DADDB/3827" COTversion="2.0x39" COTbuild="2080" Mutable="TRUE" />
  <COT_slot>-1</COT_slot>
  <FltA_L1>5</FltA_L1>
  <FltB_L1>0</FltB_L1>
  <FltA_L2>5</FltA_L2>
  <FltB_L2>4</FltB_L2>
  <AspectShutter>0</AspectShutter>
  <ShutterMode>0</ShutterMode>
  <ImageType>0</ImageType>
  <Exposure>21</Exposure>
  <Calibration>0</Calibration>
  <Resolution>1</Resolution>
</PARM>
