<?xml version="1.0" encoding="UTF-8"?>
<!-- Edited with XRT Chief Observer Tool version 2.0x40 (2080) -->
<!DOCTYPE PARM SYSTEM "XRTPAR.dtd">
<PARM>
  <modified author="SAKAO, Taro" dateTime="2012-06-04T08:20:08Z" />
  <name>Ti/Poly - 1x1 - 4096ms - Dark</name>
  <COT_info deleted="FALSE" lastUsed="2012-06-04T08:40:20Z" version="388F" locked="FALSE"
    tag="77E66350761C/388F" COTversion="2.0x40" COTbuild="2080" Mutable="TRUE" />
  <COT_slot>-1</COT_slot>
  <FltA_L1>0</FltA_L1>
  <FltB_L1>2</FltB_L1>
  <FltA_L2>0</FltA_L2>
  <FltB_L2>2</FltB_L2>
  <AspectShutter>0</AspectShutter>
  <ShutterMode>0</ShutterMode>
  <ImageType>1</ImageType>
  <Exposure>23</Exposure>
  <Calibration>0</Calibration>
  <Resolution>0</Resolution>
</PARM>
