<?xml version="1.0" encoding="UTF-8"?>
<!-- Edited with XRT Chief Observer Tool version 2.0x39 (2080) -->
<!DOCTYPE PARM SYSTEM "XRTPAR.dtd">
<PARM>
  <modified author="LEE, Jin-Yi" dateTime="2009-05-11T00:41:12Z" />
  <name>Al/Mesh - 2x2 - 723ms</name>
  <COT_info deleted="FALSE" lastUsed="2023-11-27T10:43:59Z" version="37D3" locked="FALSE"
    tag="F9983CD5C035/37D3" COTversion="2.0x39" COTbuild="2080" Mutable="TRUE" />
  <COT_slot>97</COT_slot>
  <FltA_L1>0</FltA_L1>
  <FltB_L1>1</FltB_L1>
  <FltA_L2>0</FltA_L2>
  <FltB_L2>1</FltB_L2>
  <AspectShutter>0</AspectShutter>
  <ShutterMode>0</ShutterMode>
  <ImageType>0</ImageType>
  <Exposure>18</Exposure>
  <Calibration>0</Calibration>
  <Resolution>1</Resolution>
</PARM>
