<?xml version="1.0" encoding="UTF-8"?>
<!-- Edited with XRT Chief Observer Tool version 2.0x39 (2080) -->
<!DOCTYPE PARM SYSTEM "XRTPAR.dtd">
<PARM>
  <modified author="FREED, Michael" dateTime="2014-09-08T15:51:24Z" />
  <name>Thin-Be - 1x1 - 512ms-2</name>
  <COT_info deleted="FALSE" lastUsed="2014-09-08T15:49:54Z" version="38EA" locked="FALSE"
    tag="474D7F99D1A6/38EA" COTversion="2.0x39" COTbuild="2080" Mutable="TRUE" />
  <COT_slot>-1</COT_slot>
  <FltA_L1>3</FltA_L1>
  <FltB_L1>0</FltB_L1>
  <FltA_L2>3</FltA_L2>
  <FltB_L2>0</FltB_L2>
  <AspectShutter>0</AspectShutter>
  <ShutterMode>0</ShutterMode>
  <ImageType>0</ImageType>
  <Exposure>17</Exposure>
  <Calibration>0</Calibration>
  <Resolution>0</Resolution>
</PARM>
